{
  "template_id": "imported_21d099a9",
  "source": "imported",
  "name": "creative-gradient",
  "layout_types": [
    "section",
    "title",
    "two_column",
    "summary"
  ],
  "palette": {
    "primary": "#FFFFFF",
    "secondary": "#581C87",
    "accent": "#A855F7",
    "background": "#FAF5FF",
    "text": "#1A1A1A"
  },
  "fonts": {
    "heading": "PingFang SC",
    "body": "PingFang SC"
  },
  "decorations": [
    "line_accent"
  ],
  "page_count": 10,
  "analyzed_at": "2026-07-09T04:06:17.561Z",
  "analyzer_version": "1.0.0"
}